"DESCRIPTION","DURATION IN MS","NAME","PARENT SUITE","START TIME","STATUS","STOP TIME","SUB SUITE","SUITE","TEST CLASS","TEST METHOD"
"Verify login failure with incorrect password.","5154","test_login_with_wrong_password","tests_pages","Wed Feb 04 04:16:15 UTC 2026","passed","Wed Feb 04 04:16:20 UTC 2026","TestUserLogins","test_user_logins","",""
"Verify validation error when password is not provided.","3591","test_login_with_no_password","tests_pages","Wed Feb 04 04:16:21 UTC 2026","passed","Wed Feb 04 04:16:24 UTC 2026","TestUserLogins","test_user_logins","",""
"Verify successful login with valid credentials using POM.","84162","test_login_with_valid_credentials_with_pom","tests_pages","Wed Feb 04 04:14:45 UTC 2026","passed","Wed Feb 04 04:16:09 UTC 2026","TestUserLogins","test_user_logins","",""
"Verify login failure with incorrect username.","4814","test_login_with_wrong_username","tests_pages","Wed Feb 04 04:16:10 UTC 2026","passed","Wed Feb 04 04:16:15 UTC 2026","TestUserLogins","test_user_logins","",""
"Verify home page loads correctly with Page Object Model.","1101","test_go_to_home_page_with_pom","tests_pages","Wed Feb 04 04:14:44 UTC 2026","passed","Wed Feb 04 04:14:45 UTC 2026","TestUserLogins","test_user_logins","",""
"Verify validation errors when no credentials are provided.","2951","test_login_with_no_username_or_password","tests_pages","Wed Feb 04 04:16:25 UTC 2026","passed","Wed Feb 04 04:16:28 UTC 2026","TestUserLogins","test_user_logins","",""
